{
  "format": "2",
  "generatorVersion": "0.6.0",
  "root": ".",
  "validityBasis": "aggregate-source-digest",
  "selectedPaths": [],
  "sourceSelection": {
    "includedCount": 560,
    "includedBytes": 8903085,
    "excludedCounts": {
      "excluded-directory": 4038,
      "excluded-path": 1,
      "extension": 38,
      "symlink": 18
    }
  },
  "repositoryState": {
    "available": true,
    "validationRole": "provenance",
    "repositories": [
      {
        "path": ".",
        "commit": "9352ed5aee811ade83a0d1ca4087803dd8856c96",
        "branch": "release/adobe-mcp-suite-0.3.0",
        "dirty": true,
        "remote": "https://github.com/zachshallbetter/adobe-mcp.git"
      }
    ]
  },
  "aggregateSourceDigest": "f139fc0614aabc24cd71ea972add3216d42486d1782a67767265b3603c9737eb",
  "sources": [
    {
      "path": ".formal-bootstrap.json",
      "bytes": 282,
      "sha256": "fb68ea36845c1a1c2b32517d6450d005ae11d7e9840f87fe65f4f4eeb47b2136"
    },
    {
      "path": ".github/ISSUE_TEMPLATE/bug_report.yml",
      "bytes": 1372,
      "sha256": "ac1c647659891d57b03efcdcfb79622e83f615992b97121be15392ce1fdf5fce"
    },
    {
      "path": ".github/ISSUE_TEMPLATE/config.yml",
      "bytes": 231,
      "sha256": "a19ce1b666568f2ab117095d72b6deb3e46cbd79283826704a9cb4d5711881cb"
    },
    {
      "path": ".github/ISSUE_TEMPLATE/feature_request.yml",
      "bytes": 528,
      "sha256": "a66bfc2666559ec0e3c1fd62489529d8776f29256cd7ff7c02775c6164a9d0e3"
    },
    {
      "path": ".github/pull_request_template.md",
      "bytes": 586,
      "sha256": "ed61ee112a36bd2f11e86f9a360430ecd063625cbb710b507918697ec470996b"
    },
    {
      "path": ".github/workflows/ci.yml",
      "bytes": 606,
      "sha256": "de1c984e64f6b54cdffd9337cdb06799fda1006219d68bd7212e9eb8a0481d97"
    },
    {
      "path": ".github/workflows/registry-status.yml",
      "bytes": 2110,
      "sha256": "f3df3535ad5464df6a9afa99ad50b672b2b861a062e9f7ff3940863493ca8609"
    },
    {
      "path": ".github/workflows/release.yml",
      "bytes": 3702,
      "sha256": "f10ace0b4f38d40fd80d4e07e7560eea5e5352b81ae0f327ff4298bc6ce528eb"
    },
    {
      "path": "AGENTS.md",
      "bytes": 13159,
      "sha256": "3b67b41eed8ac2f2ae301ddc9d222810e93ef71776c8cf16515ae0a636b3c0ac"
    },
    {
      "path": "CONTEXT_SOURCES.json",
      "bytes": 1317,
      "sha256": "1ceffd805fa1974611b3c3062de134b95837e4c7c3a853ca037019c37e34b415"
    },
    {
      "path": "CONTRIBUTING.md",
      "bytes": 3846,
      "sha256": "6e5b7ff4d9dcb5a467dfbac80c6be02dd0a1d03c29e3db2abd4c4ad9bcd771fd"
    },
    {
      "path": "FORMAL_RESOURCE_MANIFEST.json",
      "bytes": 274,
      "sha256": "8d6e7258f8bfd9344c585c3cc32f2a625921877a56daeee353935b98b5912f90"
    },
    {
      "path": "NEW_AGENT_PROMPT.md",
      "bytes": 1010,
      "sha256": "7fd2a102cb560b4e792ccf05a61aaf4fbf0d5139a708f03010d5d1577503bd2f"
    },
    {
      "path": "PROJECT_INTENT.md",
      "bytes": 2522,
      "sha256": "f50e5c472015dc93cb79e36ba3cdbbad41c3e5e8de61f185864ba8d85d5e85cf"
    },
    {
      "path": "PROJECT_PROFILE.json",
      "bytes": 4131,
      "sha256": "45ba754d8b67d489160007e769ad0a07b16967084664b030f9b0b91e3ae9b933"
    },
    {
      "path": "README.md",
      "bytes": 12128,
      "sha256": "f3b28ca255397e952645d5912c7b6ded072393eb834c8510d2e72077fd8b7e84"
    },
    {
      "path": "SECURITY.md",
      "bytes": 2822,
      "sha256": "00380effba30de975465958162941df15facf1b36fece8eea133ebd02def3e48"
    },
    {
      "path": "VERSION",
      "bytes": 6,
      "sha256": "97a5d6e540a6120d09c39ddb667e0e8e2bac7fcc2ffef813b82e08fd60365bce"
    },
    {
      "path": "bindings/PROJECT_BINDINGS.yaml",
      "bytes": 2964,
      "sha256": "c9890b179d45743696df7d4637fcd99f4c197f5b1b1a271c23bf691c5273aee6"
    },
    {
      "path": "contracts/README.md",
      "bytes": 387,
      "sha256": "574c6218c0c957efb2eb3bfa4bf51fbf3ab0165cc81a033a249d4ba4cc2af78e"
    },
    {
      "path": "contracts/acp-protected-effects.yaml",
      "bytes": 4298,
      "sha256": "51039f1b5961ad5c81ea713025b84c2fc843ba7d0802578d11ba283bd6c26376"
    },
    {
      "path": "docs/ACP_INTEGRATION.md",
      "bytes": 18056,
      "sha256": "ae97eb38ddd97ab3ab223ac143ac5a0c4a25ac566e82cdace69ae4fa89215680"
    },
    {
      "path": "docs/AGENT_CAPABILITIES.md",
      "bytes": 1095,
      "sha256": "9dd7e5efd745a85880c8b428ab41d25c994c033e7f5d1376a6defd343cbfdb68"
    },
    {
      "path": "docs/ALIGNMENT.md",
      "bytes": 1588,
      "sha256": "9e241f47e102b9feeb3b8e6bff3c95a146d69384f196eefc2327b363a96bf7a0"
    },
    {
      "path": "docs/AUTHORITY_MODEL.md",
      "bytes": 3352,
      "sha256": "8f92dd06848c5557c49fbce42f48aebea389cebb07017d46690af85ec4d6a3b9"
    },
    {
      "path": "docs/BOOTSTRAP_SEQUENCE.md",
      "bytes": 6140,
      "sha256": "82d04fa96aa477837c64b61a7c5f9e7617d0e325ef3e205dbd037f6ff1e91d51"
    },
    {
      "path": "docs/CONFORMANCE.md",
      "bytes": 3027,
      "sha256": "91a89475f94537685db35af38306d5455ee9bb30488fb5247527293a2e0320ba"
    },
    {
      "path": "docs/CONTEXT_COMPILATION.md",
      "bytes": 2568,
      "sha256": "cedad34d38ef2363ab29c40d29f38a5a93168e95ed647b6f729757648d748117"
    },
    {
      "path": "docs/EVIDENCE_METHOD.md",
      "bytes": 1039,
      "sha256": "a7422b9cc99adfc462a8c6d44ee883f9483c1127fbcaf0f44b1328d1d30fd4c9"
    },
    {
      "path": "docs/EXECUTION_PIPELINE.md",
      "bytes": 1861,
      "sha256": "529c01ec25ac7d0552a19d591514244ec7bbe3f1966f1dd38d2c2f69494ba2db"
    },
    {
      "path": "docs/EXECUTION_PROVIDER_CONTRACT.md",
      "bytes": 2134,
      "sha256": "f8884fe13ab6503ddc5fdb53264001b24a6bf846b00473e3f8deca5d018d5ee5"
    },
    {
      "path": "docs/EXISTING_PROJECT_ADOPTION.md",
      "bytes": 4615,
      "sha256": "549abfc3926076d522d677ba6dcaec5e6a4e1d9e3043aba70880632ffcdcbbe5"
    },
    {
      "path": "docs/FORMAL_RESOURCES.md",
      "bytes": 2845,
      "sha256": "bf93374182ba0212c7e64328a751c9dc3cfacd816779f983eca50f9157851289"
    },
    {
      "path": "docs/INITIAL_EPICS_TEMPLATE.md",
      "bytes": 1234,
      "sha256": "c3e6414393bbfb7905b4113f10571a695204538c19bbab90b5a486e7ae6a3039"
    },
    {
      "path": "docs/LANDING_AND_PROMOTION.md",
      "bytes": 1135,
      "sha256": "675a228edb135427a399e08c7fdf3a983a7802da5a20d63deb83af40fe366a23"
    },
    {
      "path": "docs/MULTI_AGENT_COORDINATION.md",
      "bytes": 2078,
      "sha256": "c27fc5594ef31ff4574582b4c6f2e69dc684bb897b9f9455fce1b50ca44f968a"
    },
    {
      "path": "docs/NEGATIVE_KNOWLEDGE.md",
      "bytes": 2169,
      "sha256": "01ef93bc7c5b75ce991d6ed0cd78faba1d8e6cdc8f1b43b10231025a0975a91e"
    },
    {
      "path": "docs/PROTOCOL_ADAPTERS.md",
      "bytes": 2229,
      "sha256": "1b546812abd66d29217fb8b11370201760ad43769f5e9c1f5e685625a7bb40aa"
    },
    {
      "path": "docs/RECOVERY.md",
      "bytes": 1115,
      "sha256": "b084f0a4bbad4012bd9d2525a07239e38ff4f563bbdefbd8491518fec14882e9"
    },
    {
      "path": "docs/SKILLS_INDEX.md",
      "bytes": 1049,
      "sha256": "fff86a343840e9a401ffc2bc6c5ddaed9d9e4cb570efd07af50790b3d70f887c"
    },
    {
      "path": "docs/UPGRADING.md",
      "bytes": 1998,
      "sha256": "123cf17c5ac29a5530da30388d1342a200b1c09b7543523862c5eeef03627a06"
    },
    {
      "path": "docs/WORK_GRAPH.md",
      "bytes": 2029,
      "sha256": "c92b74464dc44413fe264aef7082d4b065eb1e289f0ed0d85790fd74731a2dc8"
    },
    {
      "path": "docs/handbook/README.md",
      "bytes": 2960,
      "sha256": "daf4a82136f4d1b2071d8eda444934a7dc61125fcd54adf260b593d74ba98f70"
    },
    {
      "path": "docs/handbook/adding-tools.md",
      "bytes": 5487,
      "sha256": "38561142991b8b8cf87639c9e63c6a655222ffb4c3098aea59a6d763b488297a"
    },
    {
      "path": "docs/handbook/architecture.md",
      "bytes": 8534,
      "sha256": "9bceb33168a105031d15242f8491bf6b7eddbc967ce798006c043c2bf3016079"
    },
    {
      "path": "docs/handbook/briefs/aftereffects.md",
      "bytes": 2196,
      "sha256": "bb7e6dfe1c3fcfd61822b9b1edb4b535a9691ec1f45b0e516f8afa0033fea1df"
    },
    {
      "path": "docs/handbook/briefs/common.md",
      "bytes": 4550,
      "sha256": "d46ccbbe3db769e577d6d2545399207ca90fb13347f4fd02396968dded686196"
    },
    {
      "path": "docs/handbook/briefs/illustrator.md",
      "bytes": 1566,
      "sha256": "a8bd6fce6d9b2bc9ff30609aa4b0a3c3dc5e189366b6a5ed7c9ad38783a7db8e"
    },
    {
      "path": "docs/handbook/briefs/indesign.md",
      "bytes": 2832,
      "sha256": "d1fc4df8b897e47739e02d5a0d8406f887a5c376e7ef46c6e84ce093310d55ed"
    },
    {
      "path": "docs/handbook/briefs/photoshop.md",
      "bytes": 2358,
      "sha256": "a4eaf36551ff15b1572b0f71d626ee7b6f5a62bbdea0884a5ba0e8cac5d612a7"
    },
    {
      "path": "docs/handbook/briefs/premiere.md",
      "bytes": 1539,
      "sha256": "4c271903b0b70cd011e44207836916fe53987dbd1425c507135517c7b3e2ab9a"
    },
    {
      "path": "docs/handbook/capability-atlas.md",
      "bytes": 3838,
      "sha256": "1af0f86413b65923eafb28ac2943069306f118bfea65ef7844116579bd2d78c3"
    },
    {
      "path": "docs/handbook/lessons.md",
      "bytes": 5280,
      "sha256": "ea609433591cfd4b1ea47f20c5958a93f1e8d381e60327549f2079700169cbab"
    },
    {
      "path": "docs/handbook/releasing.md",
      "bytes": 2542,
      "sha256": "698792b95f1c746cf7d1da4e5fedf0fa76457ae7799d1aa3728b5075fc5e0294"
    },
    {
      "path": "docs/handbook/rules/ci.md",
      "bytes": 1139,
      "sha256": "04f63a639bb87b537b2d059b6f252cfef0e648d392ec105e091e86ee2af3a2df"
    },
    {
      "path": "docs/handbook/rules/codestyle.md",
      "bytes": 3139,
      "sha256": "62923830e444431d07e29e990168c4dba13026ed0ef6c530ed783daf500d720e"
    },
    {
      "path": "docs/handbook/rules/governance.md",
      "bytes": 1181,
      "sha256": "43ad0bca0a6b0533b075cf8d6057a9a10b31cfd45daf9fd185ba457040790143"
    },
    {